{
  "schema_version": 1,
  "id": "Seated_Dumbbell_Curl",
  "library_id": "lib:Seated_Dumbbell_Curl",
  "name": "Seated Dumbbell Curl",
  "equipment": "dumbbell",
  "base_template": "SEATED_UPRIGHT",
  "pose_modifiers": [
    "ARMS_CURL_MID"
  ],
  "stance": {
    "position": "seated",
    "width": "none",
    "laterality": "bilateral"
  },
  "grip": {
    "type": "supinated",
    "width": "shoulder"
  },
  "pose_cues": [
    "Seated upright, back supported, knees at 90 degrees, feet flat.",
    "Elbows pinned at the sides, forearms curled to about 90 degrees.",
    "Grip: supinated (shoulder width)."
  ],
  "joint_deltas": {},
  "custom_joint_overrides": {},
  "muscles": {
    "primary": [
      "biceps"
    ],
    "secondary": [
      "forearms"
    ],
    "sides": "both"
  },
  "props": [
    {
      "type": "dumbbell",
      "attach": "left_hand",
      "params": {}
    },
    {
      "type": "dumbbell",
      "attach": "right_hand",
      "params": {}
    },
    {
      "type": "seat",
      "attach": "world",
      "params": {}
    }
  ],
  "source": {
    "muscle_group": "Biceps",
    "type": "Dumbbell Curls",
    "equipment": "dumbbell",
    "also_works": "",
    "logged_as": "Weight & reps",
    "current_images": "Seated_Dumbbell_Curl/0.jpg ; Seated_Dumbbell_Curl/1.jpg"
  },
  "enrichment": {
    "template_confidence": "high",
    "matched_rule": "name:seated_curl",
    "warnings": []
  },
  "review": {
    "status": "auto",
    "notes": ""
  }
}
