{
  "schema_version": 1,
  "id": "Clean_and_Press",
  "library_id": "lib:Clean_and_Press",
  "name": "Clean and Press",
  "equipment": "barbell",
  "base_template": "STANDING_OVERHEAD_PUSH",
  "pose_modifiers": [
    "ARMS_OVERHEAD"
  ],
  "stance": {
    "position": "standing",
    "width": "hip",
    "laterality": "bilateral"
  },
  "grip": {
    "type": "pronated",
    "width": "shoulder"
  },
  "pose_cues": [
    "Standing upright, core braced, arms pressed overhead.",
    "Arms locked out overhead.",
    "Grip: pronated (shoulder width).",
    "Stance width: hip."
  ],
  "joint_deltas": {},
  "custom_joint_overrides": {},
  "muscles": {
    "primary": [
      "deltoid_anterior",
      "deltoid_lateral"
    ],
    "secondary": [
      "quadriceps",
      "gluteus_maximus",
      "trapezius_upper",
      "rectus_abdominis",
      "obliques"
    ],
    "sides": "both"
  },
  "props": [
    {
      "type": "barbell",
      "attach": "hands",
      "params": {}
    }
  ],
  "source": {
    "muscle_group": "Shoulders",
    "type": "Olympic, Power & Explosive",
    "equipment": "barbell",
    "also_works": "",
    "logged_as": "Weight & reps",
    "current_images": "Clean_and_Press/0.jpg ; Clean_and_Press/1.jpg"
  },
  "enrichment": {
    "template_confidence": "medium",
    "matched_rule": "name:snatch_jerk",
    "warnings": []
  },
  "review": {
    "status": "needs_review",
    "notes": ""
  }
}
