{
  "schema_version": 1,
  "id": "Standing_Overhead_Barbell_Triceps_Extension",
  "library_id": "lib:Standing_Overhead_Barbell_Triceps_Extension",
  "name": "Standing Overhead Barbell Triceps Extension",
  "equipment": "barbell",
  "base_template": "STANDING_NEUTRAL",
  "pose_modifiers": [
    "ARMS_OVERHEAD_EXTENSION"
  ],
  "stance": {
    "position": "standing",
    "width": "hip",
    "laterality": "bilateral"
  },
  "grip": {
    "type": "pronated",
    "width": "shoulder"
  },
  "pose_cues": [
    "Standing upright, feet hip-width, torso vertical, arms at the sides.",
    "Upper arms overhead, elbows bent so the hands are behind the head.",
    "Grip: pronated (shoulder width).",
    "Stance width: hip."
  ],
  "joint_deltas": {},
  "custom_joint_overrides": {},
  "muscles": {
    "primary": [
      "triceps"
    ],
    "secondary": [
      "deltoid_anterior"
    ],
    "sides": "both"
  },
  "props": [
    {
      "type": "barbell",
      "attach": "hands",
      "params": {}
    }
  ],
  "source": {
    "muscle_group": "Triceps",
    "type": "Overhead & Standing Extensions",
    "equipment": "barbell",
    "also_works": "",
    "logged_as": "Weight & reps",
    "current_images": "Standing_Overhead_Barbell_Triceps_Extension/0.jpg ; Standing_Overhead_Barbell_Triceps_Extension/1.jpg"
  },
  "enrichment": {
    "template_confidence": "high",
    "matched_rule": "name:overhead_extension",
    "warnings": [
      "Type 'Overhead & Standing Extensions' not in type_secondary; used muscle group default secondaries."
    ]
  },
  "review": {
    "status": "auto",
    "notes": ""
  }
}
