{
  "schema_version": 1,
  "id": "Standing_Palm-In_One-Arm_Dumbbell_Press",
  "library_id": "lib:Standing_Palm-In_One-Arm_Dumbbell_Press",
  "name": "Standing Palm-In One-Arm Dumbbell Press",
  "equipment": "dumbbell",
  "base_template": "STANDING_OVERHEAD_PUSH",
  "pose_modifiers": [
    "ARMS_OVERHEAD",
    "SINGLE_ARM_RIGHT"
  ],
  "stance": {
    "position": "standing",
    "width": "hip",
    "laterality": "unilateral_right"
  },
  "grip": {
    "type": "pronated",
    "width": "shoulder"
  },
  "pose_cues": [
    "Standing upright, core braced, arms pressed overhead.",
    "Arms locked out overhead.",
    "Right arm is the working arm; left arm relaxed or bracing.",
    "Grip: pronated (shoulder width).",
    "Stance width: hip.",
    "Laterality: unilateral right (right side shown as working side)."
  ],
  "joint_deltas": {},
  "custom_joint_overrides": {},
  "muscles": {
    "primary": [
      "deltoid_anterior",
      "deltoid_lateral"
    ],
    "secondary": [
      "triceps",
      "trapezius_upper"
    ],
    "sides": "right"
  },
  "props": [
    {
      "type": "dumbbell",
      "attach": "right_hand",
      "params": {}
    }
  ],
  "source": {
    "muscle_group": "Shoulders",
    "type": "Overhead Presses",
    "equipment": "dumbbell",
    "also_works": "",
    "logged_as": "Weight & reps",
    "current_images": "Standing_Palm-In_One-Arm_Dumbbell_Press/0.jpg ; Standing_Palm-In_One-Arm_Dumbbell_Press/1.jpg"
  },
  "enrichment": {
    "template_confidence": "medium",
    "matched_rule": "type:\\bshoulder press|\\boverhead press|\\bmilitary",
    "warnings": [
      "Type 'Overhead Presses' not in type_secondary; used muscle group default secondaries."
    ]
  },
  "review": {
    "status": "needs_review",
    "notes": ""
  }
}
