{
  "schema_version": 1,
  "id": "One-Arm_Kettlebell_Floor_Press",
  "library_id": "lib:One-Arm_Kettlebell_Floor_Press",
  "name": "One-Arm Kettlebell Floor Press",
  "equipment": "kettlebell",
  "base_template": "SUPINE_FLOOR",
  "pose_modifiers": [
    "ARMS_PRESS_LOCKOUT",
    "SINGLE_ARM_RIGHT"
  ],
  "stance": {
    "position": "supine",
    "width": "none",
    "laterality": "unilateral_right"
  },
  "grip": {
    "type": "neutral",
    "width": "shoulder"
  },
  "pose_cues": [
    "Lying on the back on the floor.",
    "Arms extended vertically over the chest (top of the press).",
    "Right arm is the working arm; left arm relaxed or bracing.",
    "Grip: neutral (shoulder width).",
    "Laterality: unilateral right (right side shown as working side)."
  ],
  "joint_deltas": {},
  "custom_joint_overrides": {},
  "muscles": {
    "primary": [
      "pectoralis_lower",
      "pectoralis_upper"
    ],
    "secondary": [
      "deltoid_anterior",
      "triceps"
    ],
    "sides": "right"
  },
  "props": [
    {
      "type": "kettlebell",
      "attach": "right_hand",
      "params": {}
    }
  ],
  "source": {
    "muscle_group": "Chest",
    "type": "Flat Presses",
    "equipment": "kettlebells",
    "also_works": "",
    "logged_as": "Weight & reps",
    "current_images": "One-Arm_Kettlebell_Floor_Press/0.jpg ; One-Arm_Kettlebell_Floor_Press/1.jpg"
  },
  "enrichment": {
    "template_confidence": "high",
    "matched_rule": "name:floor_press",
    "warnings": []
  },
  "review": {
    "status": "auto",
    "notes": ""
  }
}
