{
  "schema_version": 1,
  "id": "Stride_Jump_Crossover",
  "library_id": "lib:Stride_Jump_Crossover",
  "name": "Stride Jump Crossover",
  "equipment": "other",
  "base_template": "SQUAT",
  "pose_modifiers": [],
  "stance": {
    "position": "standing",
    "width": "shoulder",
    "laterality": "bilateral"
  },
  "grip": {
    "type": "none",
    "width": "none"
  },
  "pose_cues": [
    "Squat position: hips back and down, thighs near parallel, knees tracking over toes, chest up.",
    "Stance width: shoulder."
  ],
  "joint_deltas": {},
  "custom_joint_overrides": {},
  "muscles": {
    "primary": [
      "quadriceps"
    ],
    "secondary": [
      "gluteus_maximus",
      "adductors"
    ],
    "sides": "both"
  },
  "props": [],
  "source": {
    "muscle_group": "Quadriceps",
    "type": "Jumps & Plyometrics",
    "equipment": "other",
    "also_works": "",
    "logged_as": "Weight & reps",
    "current_images": "Stride_Jump_Crossover/0.jpg ; Stride_Jump_Crossover/1.jpg"
  },
  "enrichment": {
    "template_confidence": "low",
    "matched_rule": "muscle_group:Quadriceps",
    "warnings": [
      "Type 'Jumps & Plyometrics' not in type_secondary; used muscle group default secondaries."
    ]
  },
  "review": {
    "status": "needs_review",
    "notes": ""
  }
}
