{
  "schema_version": 1,
  "id": "Front_Squat_Clean_Grip",
  "library_id": "lib:Front_Squat_Clean_Grip",
  "name": "Front Squat (Clean Grip)",
  "equipment": "barbell",
  "base_template": "SQUAT",
  "pose_modifiers": [
    "ARMS_FRONT_RACK"
  ],
  "stance": {
    "position": "standing",
    "width": "shoulder",
    "laterality": "bilateral"
  },
  "grip": {
    "type": "pronated",
    "width": "shoulder"
  },
  "pose_cues": [
    "Squat position: hips back and down, thighs near parallel, knees tracking over toes, chest up.",
    "Bar racked on the front of the shoulders, elbows high.",
    "Grip: pronated (shoulder width).",
    "Stance width: shoulder."
  ],
  "joint_deltas": {},
  "custom_joint_overrides": {},
  "muscles": {
    "primary": [
      "quadriceps"
    ],
    "secondary": [
      "gluteus_maximus",
      "adductors"
    ],
    "sides": "both"
  },
  "props": [
    {
      "type": "barbell",
      "attach": "front_rack",
      "params": {}
    }
  ],
  "source": {
    "muscle_group": "Quadriceps",
    "type": "Olympic Lifts",
    "equipment": "barbell",
    "also_works": "",
    "logged_as": "Weight & reps",
    "current_images": "Front_Squat_Clean_Grip/0.jpg ; Front_Squat_Clean_Grip/1.jpg"
  },
  "enrichment": {
    "template_confidence": "high",
    "matched_rule": "name:squat",
    "warnings": [
      "Type 'Olympic Lifts' not in type_secondary; used muscle group default secondaries."
    ]
  },
  "review": {
    "status": "auto",
    "notes": ""
  }
}
