{
  "schema_version": 1,
  "id": "Rope_Climb",
  "library_id": "lib:Rope_Climb",
  "name": "Rope Climb",
  "equipment": "other",
  "base_template": "HANGING",
  "pose_modifiers": [],
  "stance": {
    "position": "hanging",
    "width": "none",
    "laterality": "bilateral"
  },
  "grip": {
    "type": "neutral",
    "width": "shoulder"
  },
  "pose_cues": [
    "Hanging from an overhead bar, body vertical, legs straight or slightly bent.",
    "Grip: neutral (shoulder width)."
  ],
  "joint_deltas": {},
  "custom_joint_overrides": {},
  "muscles": {
    "primary": [
      "latissimus_dorsi"
    ],
    "secondary": [
      "biceps",
      "deltoid_posterior",
      "trapezius_middle",
      "forearms"
    ],
    "sides": "both"
  },
  "props": [
    {
      "type": "pullup_bar",
      "attach": "hands",
      "params": {}
    }
  ],
  "source": {
    "muscle_group": "Lats",
    "type": "Pull-ups & Chin-ups",
    "equipment": "other",
    "also_works": "",
    "logged_as": "Weight & reps",
    "current_images": "Rope_Climb/0.jpg ; Rope_Climb/1.jpg"
  },
  "enrichment": {
    "template_confidence": "medium",
    "matched_rule": "type:\\bpull ?ups?\\b|\\bchin",
    "warnings": []
  },
  "review": {
    "status": "needs_review",
    "notes": ""
  }
}
