{
  "schema_version": 1,
  "id": "Incline_Push-Up_Wide",
  "library_id": "lib:Incline_Push-Up_Wide",
  "name": "Incline Push-Up Wide",
  "equipment": "bodyweight",
  "base_template": "PRONE_PUSH",
  "pose_modifiers": [],
  "stance": {
    "position": "plank",
    "width": "none",
    "laterality": "bilateral"
  },
  "grip": {
    "type": "open_palm",
    "width": "wide"
  },
  "pose_cues": [
    "Plank position: body straight from head to heels, hands under shoulders.",
    "Grip: open palm (wide width)."
  ],
  "joint_deltas": {},
  "custom_joint_overrides": {},
  "muscles": {
    "primary": [
      "pectoralis_upper"
    ],
    "secondary": [
      "pectoralis_lower",
      "deltoid_anterior",
      "triceps"
    ],
    "sides": "both"
  },
  "props": [],
  "source": {
    "muscle_group": "Chest",
    "type": "Push-ups & Dips",
    "equipment": "body only",
    "also_works": "",
    "logged_as": "Reps",
    "current_images": "Incline_Push-Up_Wide/0.jpg ; Incline_Push-Up_Wide/1.jpg"
  },
  "enrichment": {
    "template_confidence": "high",
    "matched_rule": "name:push_up",
    "warnings": [
      "Type 'Push-ups & Dips' not in type_secondary; used muscle group default secondaries."
    ]
  },
  "review": {
    "status": "auto",
    "notes": ""
  }
}
